{
  "$schema": "./release-privacy-inventory.schema.json",
  "schemaVersion": "1.0.0",
  "inventoryVersion": "0.3.3",
  "authority": {
    "owner": "OpenJob",
    "scope": "release-privacy-and-store-preparation",
    "semanticBaseline": "issue-40-approved-native-behavior"
  },
  "publicUrls": {
    "privacyPolicy": {
      "displayName": "Privacy policy",
      "requiredBeforeSubmission": true,
      "status": "planned",
      "url": "https://openjob.dev/privacy",
      "implementationIssue": 40
    },
    "accountDeletion": {
      "displayName": "Account deletion request",
      "requiredBeforeSubmission": true,
      "status": "planned",
      "url": "https://openjob.dev/account-deletion",
      "implementationIssue": 42
    },
    "support": {
      "displayName": "Public support",
      "requiredBeforeSubmission": true,
      "status": "live",
      "url": "https://openjob.dev"
    }
  },
  "accountDeletion": {
    "requiredByStore": true,
    "status": "pending",
    "publicUrlId": "accountDeletion",
    "implementationIssue": 42,
    "inAppAvailable": false,
    "publicRequestAvailable": false
  },
  "security": {
    "encryptedInTransit": true
  },
  "processors": [
    {
      "id": "openjob-api",
      "displayName": "OpenJob API",
      "authority": "openjob",
      "owner": "OpenJob",
      "role": "app-service",
      "candidateReconciliationRequired": true,
      "nativeDependencyPackages": []
    },
    {
      "id": "firebase-auth",
      "displayName": "Firebase Authentication and Identity Platform",
      "authority": "third-party",
      "owner": "Google",
      "role": "authentication",
      "candidateReconciliationRequired": true,
      "nativeDependencyPackages": []
    },
    {
      "id": "apple-signin",
      "displayName": "Sign in with Apple",
      "authority": "third-party",
      "owner": "Apple",
      "role": "authentication",
      "candidateReconciliationRequired": true,
      "nativeDependencyPackages": ["@invertase/react-native-apple-authentication"]
    },
    {
      "id": "google-signin",
      "displayName": "Google Sign-In",
      "authority": "third-party",
      "owner": "Google",
      "role": "authentication",
      "candidateReconciliationRequired": true,
      "nativeDependencyPackages": ["@react-native-google-signin/google-signin"]
    },
    {
      "id": "sentry",
      "displayName": "Sentry",
      "authority": "third-party",
      "owner": "Functional Software, Inc.",
      "role": "diagnostics",
      "candidateReconciliationRequired": true,
      "nativeDependencyPackages": ["@sentry/react-native"]
    },
    {
      "id": "apple-os-quality",
      "displayName": "Apple operating-system quality reports",
      "authority": "third-party",
      "owner": "Apple",
      "role": "operating-system-quality",
      "candidateReconciliationRequired": true,
      "nativeDependencyPackages": []
    },
    {
      "id": "google-play-quality",
      "displayName": "Google Play and Android quality reports",
      "authority": "third-party",
      "owner": "Google",
      "role": "operating-system-quality",
      "candidateReconciliationRequired": true,
      "nativeDependencyPackages": []
    }
  ],
  "permissions": [
    {
      "id": "ios-apple-sign-in-entitlement",
      "displayName": "Sign in with Apple entitlement",
      "platform": "ios",
      "disposition": "required",
      "processorIds": ["apple-signin"],
      "nativeConfiguration": {
        "kind": "ios-entitlement",
        "key": "com.apple.developer.applesignin",
        "value": ["Default"]
      }
    },
    {
      "id": "ios-uses-apple-sign-in",
      "displayName": "Expo Sign in with Apple capability",
      "platform": "ios",
      "disposition": "required",
      "processorIds": ["apple-signin"],
      "nativeConfiguration": {
        "kind": "expo-boolean",
        "key": "usesAppleSignIn",
        "value": true
      }
    },
    {
      "id": "ios-face-id-description",
      "displayName": "Face ID usage description",
      "platform": "ios",
      "disposition": "blocked",
      "processorIds": [],
      "nativeConfiguration": {
        "kind": "expo-plugin-boolean",
        "plugin": "expo-secure-store",
        "key": "faceIDPermission",
        "value": false
      }
    },
    {
      "id": "android-internet",
      "displayName": "Android network access",
      "platform": "android",
      "disposition": "required",
      "processorIds": ["openjob-api", "firebase-auth", "sentry"],
      "nativeConfiguration": {
        "kind": "android-required-permission",
        "value": "android.permission.INTERNET"
      }
    },
    {
      "id": "android-read-external-storage",
      "displayName": "Legacy external storage read",
      "platform": "android",
      "disposition": "blocked",
      "processorIds": [],
      "nativeConfiguration": {
        "kind": "android-blocked-permission",
        "value": "android.permission.READ_EXTERNAL_STORAGE"
      }
    },
    {
      "id": "android-system-alert-window",
      "displayName": "Draw over other apps",
      "platform": "android",
      "disposition": "blocked",
      "processorIds": [],
      "nativeConfiguration": {
        "kind": "android-blocked-permission",
        "value": "android.permission.SYSTEM_ALERT_WINDOW"
      }
    },
    {
      "id": "android-write-external-storage",
      "displayName": "Legacy external storage write",
      "platform": "android",
      "disposition": "blocked",
      "processorIds": [],
      "nativeConfiguration": {
        "kind": "android-blocked-permission",
        "value": "android.permission.WRITE_EXTERNAL_STORAGE"
      }
    }
  ],
  "dataPractices": [
    {
      "id": "name",
      "authority": "openjob",
      "displayName": "Name",
      "collection": "required",
      "collectionCondition": "account-creation-or-sign-in",
      "linked": true,
      "tracking": false,
      "shared": false,
      "sold": false,
      "encryptedInTransit": true,
      "processorIds": ["openjob-api", "firebase-auth", "apple-signin", "google-signin"],
      "permissionIds": [],
      "apple": {
        "collected": true,
        "dataType": "NSPrivacyCollectedDataTypeName",
        "purposes": ["NSPrivacyCollectedDataTypePurposeAppFunctionality"]
      },
      "play": {
        "collected": true,
        "dataType": "Personal info > Name",
        "purposes": ["App functionality", "Account management"]
      }
    },
    {
      "id": "email-address",
      "authority": "openjob",
      "displayName": "Email address",
      "collection": "required",
      "collectionCondition": "account-creation-or-sign-in",
      "linked": true,
      "tracking": false,
      "shared": false,
      "sold": false,
      "encryptedInTransit": true,
      "processorIds": ["openjob-api", "firebase-auth", "apple-signin", "google-signin"],
      "permissionIds": [],
      "apple": {
        "collected": true,
        "dataType": "NSPrivacyCollectedDataTypeEmailAddress",
        "purposes": ["NSPrivacyCollectedDataTypePurposeAppFunctionality"]
      },
      "play": {
        "collected": true,
        "dataType": "Personal info > Email address",
        "purposes": ["App functionality", "Account management"]
      }
    },
    {
      "id": "user-id",
      "authority": "openjob",
      "displayName": "User ID",
      "collection": "required",
      "collectionCondition": "account-creation-or-sign-in",
      "linked": true,
      "tracking": false,
      "shared": false,
      "sold": false,
      "encryptedInTransit": true,
      "processorIds": ["openjob-api", "firebase-auth"],
      "permissionIds": [],
      "apple": {
        "collected": true,
        "dataType": "NSPrivacyCollectedDataTypeUserID",
        "purposes": ["NSPrivacyCollectedDataTypePurposeAppFunctionality"]
      },
      "play": {
        "collected": true,
        "dataType": "Personal info > User IDs",
        "purposes": ["App functionality", "Account management"]
      }
    },
    {
      "id": "product-interaction",
      "authority": "openjob",
      "displayName": "Product interaction",
      "collection": "required",
      "collectionCondition": "authenticated-app-functionality",
      "linked": true,
      "tracking": false,
      "shared": false,
      "sold": false,
      "encryptedInTransit": true,
      "processorIds": ["openjob-api"],
      "permissionIds": [],
      "apple": {
        "collected": true,
        "dataType": "NSPrivacyCollectedDataTypeProductInteraction",
        "purposes": ["NSPrivacyCollectedDataTypePurposeAppFunctionality"]
      },
      "play": {
        "collected": true,
        "dataType": "App activity > App interactions",
        "purposes": ["App functionality"]
      }
    },
    {
      "id": "crash-data",
      "authority": "openjob",
      "displayName": "Crash data",
      "collection": "optional",
      "collectionCondition": "share-diagnostics-enabled",
      "linked": false,
      "tracking": false,
      "shared": false,
      "sold": false,
      "encryptedInTransit": true,
      "processorIds": ["sentry"],
      "permissionIds": [],
      "apple": {
        "collected": true,
        "dataType": "NSPrivacyCollectedDataTypeCrashData",
        "purposes": ["NSPrivacyCollectedDataTypePurposeAppFunctionality"]
      },
      "play": {
        "collected": true,
        "dataType": "App info and performance > Crash logs",
        "purposes": ["App functionality", "Analytics"]
      }
    },
    {
      "id": "performance-data",
      "authority": "openjob",
      "displayName": "Performance data",
      "collection": "optional",
      "collectionCondition": "share-diagnostics-enabled",
      "linked": false,
      "tracking": false,
      "shared": false,
      "sold": false,
      "encryptedInTransit": true,
      "processorIds": ["sentry"],
      "permissionIds": [],
      "apple": {
        "collected": true,
        "dataType": "NSPrivacyCollectedDataTypePerformanceData",